{
  "$schema": "https://json-schema.org/draft/2020-12/schema",
  "$id": "diorama.schema.json",
  "title": "A scene-host diorama: a real map, a camera and a few idle units",
  "type": "object",
  "additionalProperties": false,
  "required": ["id", "map", "camera", "units", "plate"],
  "$defs": {
    "tile": { "type": "array", "items": { "type": "integer", "minimum": 0, "maximum": 255 }, "minItems": 2, "maxItems": 2 }
  },
  "properties": {
    "id": { "type": "string", "pattern": "^[a-z][a-z0-9_]*$" },
    "map": { "type": "string", "pattern": "^[a-z][a-z0-9_]*$", "description": "A data/maps id; the app test proves it exists." },
    "camera": {
      "type": "object",
      "additionalProperties": false,
      "required": ["at", "zoom_at_1080p"],
      "properties": {
        "at": { "$ref": "#/$defs/tile" },
        "zoom_at_1080p": {
          "type": "number",
          "minimum": 0.35,
          "maximum": 2.5,
          "description": "Zoom at a 1920x1080 host layer; other sizes follow hostZoom's cover law. Bounds are main.ts's player zoom clamp."
        }
      }
    },
    "units": {
      "type": "array",
      "minItems": 1,
      "maxItems": 12,
      "items": {
        "type": "object",
        "additionalProperties": false,
        "required": ["unit", "at"],
        "properties": {
          "unit": { "type": "string", "pattern": "^[a-z][a-z0-9_]*$" },
          "at": { "$ref": "#/$defs/tile" },
          "facing_deg": { "type": "number", "minimum": 0, "maximum": 360, "description": "The mission placement's own field and conversion (mission.ts)." }
        }
      }
    },
    "plate": { "type": "string", "pattern": "^ui/[a-z0-9_]+\\.jpg$", "description": "Path under assets/, photographed from the host by pnpm plate:host." }
  }
}
